Audio;2025040111115681103265267559660601,5752482020,AUDIO,"um, you are going to get the email and all we ask is that you complete that email and send it back to me as soon as you can and other than that you will be all set when the tech comes by, they are going to install your services and once they leave you will um be able to receive calls in you know from that business number um that we are going to be porting over and that number is XXX-XXX-XXXX.",1772670
Audio;2025040111115681103265267559660601,5752482237,AUDIO,"XXX-XXX-XXX, yes.",1800160
Audio;2025040111115681103265267559660601,5752482021,AUDIO,OK perfect just wanted to make sure.,1803479
Audio;2025040111115681103265267559660601,5752482238,AUDIO,"Uh, so what, what is the best number that I can, uh",1803890
Audio;2025040111115681103265267559660601,5752482239,AUDIO,I can reach you like,1803890
Audio;2025040111115681103265267559660601,5752482240,AUDIO,"You know, you know, can talk about it, you know.",1810290
Audio;2025040111115681103265267559660601,5752482022,AUDIO,Well what I am going to do is I am about to email you.,1811660
Audio;2025040111115681103265267559660601,5752482023,AUDIO,"I am about to email you so this way if you need anything because I am going to be your, your account manager so if you need anything you just email me back and I will take care of it.",1814619
Audio;2025040111115681103265267559660601,5752482241,AUDIO,Mhm.,1817589
Audio;2025040111115681103265267559660601,5752482024,AUDIO,So I am going to email you.,1824540
Audio;2025040111115681103265267559660601,5752482025,AUDIO,I will place you on a brief hold.,1825939
Audio;2025040111115681103265267559660601,5752482026,AUDIO,"I will send you a test email, um, so this way I make sure you get it",1827020
Audio;2025040111115681103265267559660601,5752482027,AUDIO,then if you need anything else you could just email me back,1827020
Audio;2025040111115681103265267559660601,5752482242,AUDIO,OK.,1833849
Audio;2025040111115681103265267559660601,5752482028,AUDIO,"Alright, so yeah, I am going to place you on a brief hold",1834750
Audio;2025040111115681103265267559660601,5752482029,AUDIO,I will send you a test email so you can get in contact with me if you need to,1834750
Audio;2025040111115681103265267559660601,5752482243,AUDIO,OK.,1840560
Audio;2025040111115681103265267559660601,5752482030,AUDIO,"Alright, be right back.",1841479
Audio;2025040111115681103265267559660601,5752482031,AUDIO,"Alright, so I, I just sent out the test email to you, uh, just also look out.",1992939
Audio;2025040111115681103265267559660601,5752482032,AUDIO,For uh that email too for the LOA.,2000739
Audio;2025040111115681103265267559660601,5752482244,AUDIO,Mhm.,2004709
Audio;2025040111115681103265267559660601,5752482033,AUDIO,"All right, and as I said, once you complete that, uh, please email that back to me um as soon as possible and uh other than that you are all, you are all set, uh, congratulations and also the email I sent you, it does include.",2005920
Audio;2025040111115681103265267559660601,5752482034,AUDIO,Let me see here.,2023060
Audio;2025040111115681103265267559660601,5752482035,AUDIO,One moment here.,2025410
Audio;2025040111115681103265267559660601,5752482245,AUDIO,"Optimum business, so.",2031400
Audio;2025040111115681103265267559660601,5752482036,AUDIO,"Alright, so yeah, it does include um your account number, uh and it also includes your access code as well just so that you have that.",2033510
Audio;2025040111115681103265267559660601,5752482037,AUDIO,"I know that you created that yourself, it is just sometimes.",2042109
Audio;2025040111115681103265267559660601,5752482246,AUDIO,Yeah.,2048530
Audio;2025040111115681103265267559660601,5752482038,AUDIO,People forget.,2048629
Audio;2025040111115681103265267559660601,5752482039,AUDIO,I do not know what is going on here.,2049949
Audio;2025040111115681103265267559660601,5752482040,AUDIO,One second.,2051870
Audio;2025040111115681103265267559660601,5752482041,AUDIO,So like the the.,2061330
Audio;2025040111115681103265267559660601,5752482042,AUDIO,One moment here.,2066138
Audio;2025040111115681103265267559660601,5752482043,AUDIO,"OK, so it looks like it was for Tuesday.",2072510
Audio;2025040111115681103265267559660601,5752482044,AUDIO,Now it is showing me Wednesday.,2074860
Audio;2025040111115681103265267559660601,5752482045,AUDIO,Let me just confirm here.,2076199
Audio;2025040111115681103265267559660601,5752482247,AUDIO,"Wednesday is fine, you know, it is not a big deal.",2084418
Audio;2025040111115681103265267559660601,5752482046,AUDIO,"OK, yeah, so, yeah, so it is going to be confirmed for Wednesday.",2085909
Audio;2025040111115681103265267559660601,5752482047,AUDIO,"You are all set, um, and the email and everything has been received, um, alright, so yeah, OK, and I got everything back from you, perfect.",2089330
Audio;2025040111115681103265267559660601,5752482048,AUDIO,"So yeah, you are all set if again if you need anything else, if you are interested in a cell phone or anything in the future, if you want to open up another location, anything you need at all, um, you email me",2098020
Audio;2025040111115681103265267559660601,5752482049,AUDIO,I will get back to you as soon as possible,2098020
Audio;2025040111115681103265267559660601,5752482248,AUDIO,"If I, if I put my phone line like I have like XXX.",2110649
Audio;2025040111115681103265267559660601,5752482249,AUDIO,XX phone line you you going to be discount right because right now my cell phone.,2116320
Audio;2025040111115681103265267559660601,5752482050,AUDIO,"Correct, so yes, exactly, yes, so keep that in mind and this is what I want you to know whatever discount you get on the cell phone, it is for as long as you have a phone so it does not expire, it is not like next year or the year after that they are going to keep giving you that discount.",2120860
Audio;2025040111115681103265267559660601,5752482250,AUDIO,"OK, and uh what about the price like going to be XXX for when we go up or down or something like that?",2138270
Audio;2025040111115681103265267559660601,5752482051,AUDIO,"Well, no, so you are going to be, you are going to be in a X year promo.",2145540
Audio;2025040111115681103265267559660601,5752482052,AUDIO,"So as your account manager if you ever want to make changes or if say your promo is about to expire, you want me to put you in a different one, that is when I come in",2148580
Audio;2025040111115681103265267559660601,5752482053,AUDIO,I work my magic to make sure that you know you can keep what you have,2148580
Audio;2025040111115681103265267559660601,5752482054,AUDIO,you know we will we will put you in the best promo we have,2148580
Audio;2025040111115681103265267559660601,5752482251,AUDIO,OK.,2164300
Audio;2025040111115681103265267559660601,5752482055,AUDIO,"Alright, so again when I say if you need something you just email me so this way you do not have to call in and get transferred",2165189
Audio;2025040111115681103265267559660601,5752482056,AUDIO,I have to wait you can just email me I am your account manager,2165189
Audio;2025040111115681103265267559660601,5752482057,AUDIO,I will update your account for you,2165189
Audio;2025040111115681103265267559660601,5752482252,AUDIO,"OK, and uh this on the 8th on the Wednesday on the 9th, right?",2177219
Audio;2025040111115681103265267559660601,5752482058,AUDIO,Mhm.,2183129
Audio;2025040111115681103265267559660601,5752482253,AUDIO,On the 9th when they come.,2183600
Audio;2025040111115681103265267559660601,5752482254,AUDIO,"They are going to hook up and everything, install the phone line and internet and everything",2186899
Audio;2025040111115681103265267559660601,5752482255,AUDIO,"the same number like I have, right",2186899
Audio;2025040111115681103265267559660601,5752482059,AUDIO,"Exactly, so they are going to install everything and when they leave your phone number that everyone has been calling will be up and running and you will be able to log in and create your account online.",2193689
Audio;2025040111115681103265267559660601,5752482060,AUDIO,"So you will be able to do everything, you know, once they leave and you will be up and running and then you can cancel whatever service you currently have and you know move on with the better service that you like with Optimum.",2203689
Audio;2025040111115681103265267559660601,5752482256,AUDIO,"OK, OK.",2214790
Audio;2025040111115681103265267559660601,5752482061,AUDIO,"Alright, well, so you are all set.",2216590
Audio;2025040111115681103265267559660601,5752482062,AUDIO,"Uh, I got your back",2218310
Audio;2025040111115681103265267559660601,5752482063,AUDIO,"you know, congratulations",2218310
Audio;2025040111115681103265267559660601,5752482257,AUDIO,"OK, thanks.",2222159
Audio;2025040111115681103265267559660601,5752482064,AUDIO,Thanks for choosing Optimum.,2223310
Audio;2025040111115681103265267559660601,5752482065,AUDIO,"You have a great day, my friend.",2224389
Audio;2025040111115681103265267559660601,5752482258,AUDIO,"OK, bye.",2225870
